{
  "id": "lake-garda-camp",
  "title": "Torbole Wind Cove",
  "category": "Lakeside Camp",
  "city": "Riva del Garda",
  "latitude": 45.8711,
  "longitude": 10.8752,
  "rating": 5,
  "best_season": "Spring",
  "description": "Windsurfing haven, clear waters, pebble beach camping with sunset barbecue spots."
}