{
  "id": "secret-beach-cove",
  "title": "Cala Violina Pine Cove",
  "category": "Beach Spot",
  "city": "Maremma Coast",
  "latitude": 42.8596,
  "longitude": 10.7788,
  "rating": 5,
  "best_season": "Summer",
  "description": "Hidden quartz-sand cove accessible only via a 2km trail through coastal pine forest."
}