{
  "id": "dolomites-refuge",
  "title": "Tre Cime Alpine Refuge",
  "category": "Mountain Cabin",
  "city": "Cortina d'Ampezzo",
  "latitude": 46.6186,
  "longitude": 12.2981,
  "rating": 5,
  "best_season": "Summer",
  "description": "High-altitude wooden refuge with panoramic peaks, solar power, and wood-fired sauna."
}