{
  "id": "vintage-arcade-den",
  "title": "Pixel Vault Retro Lounge",
  "category": "Retro Arcade",
  "city": "Bologna",
  "latitude": 44.4949,
  "longitude": 11.3426,
  "rating": 4,
  "best_season": "Year-round",
  "description": "Underground community arcade with 80s pinballs, modular synth corner, and craft brews."
}